{
  "id": "lossy-persian",
  "name": "Persian-compatible (lossy)",
  "description": "Writes Gilaki with ordinary Persian letters. Schwa and several vowel contrasts are collapsed.",
  "script": "Arab",
  "direction": "rtl",
  "lossy": true,
  "normalize": "NFC",
  "separator": "",
  "rules": [
    { "ipa": "tʃ", "out": "چ" },
    { "ipa": "dʒ", "out": "ج" },
    { "ipa": "ʃ", "out": "ش" },
    { "ipa": "ʒ", "out": "ژ" },
    { "ipa": "iː", "out": "ی" },
    { "ipa": "uː", "out": "و" },
    { "ipa": "ə", "out": "ا" },
    { "ipa": "ä", "out": "ا" },
    { "ipa": "ɒ", "out": "آ" },
    { "ipa": "ɛ", "out": "ا" },
    { "ipa": "ü", "out": "و" },
    { "ipa": "i", "out": "ی" },
    { "ipa": "e", "out": "ا" },
    { "ipa": "a", "out": "ا" },
    { "ipa": "o", "out": "و" },
    { "ipa": "u", "out": "و" },
    { "ipa": "p", "out": "پ" },
    { "ipa": "b", "out": "ب" },
    { "ipa": "t", "out": "ت" },
    { "ipa": "d", "out": "د" },
    { "ipa": "k", "out": "ک" },
    { "ipa": "g", "out": "گ" },
    { "ipa": "ʔ", "out": "ع" },
    { "ipa": "f", "out": "ف" },
    { "ipa": "v", "out": "و" },
    { "ipa": "s", "out": "س" },
    { "ipa": "z", "out": "ز" },
    { "ipa": "x", "out": "خ" },
    { "ipa": "ɣ", "out": "غ" },
    { "ipa": "h", "out": "ه" },
    { "ipa": "m", "out": "م" },
    { "ipa": "n", "out": "ن" },
    { "ipa": "ŋ", "out": "نگ" },
    { "ipa": "l", "out": "ل" },
    { "ipa": "r", "out": "ر" },
    { "ipa": "j", "out": "ی" }
  ]
}
